{
  "tagline": "Une extension navigateur qui scrape la page que tu regardes vers un service connecté",
  "verdictSummary": "Une extension navigateur capable de scraper des données structurées de la page que tu regardes et de les envoyer vers un autre service — le vrai tour de Bardeen, qui fonctionne même sur des sites sans API — c’est un vrai projet de week-end en utilisant un content script et un ensemble fixe de deux ou trois paires site/service. Ce qui ne survit pas : la bibliothèque de centaines de « playbooks » préconstruits de Bardeen à travers de nombreuses combinaisons de sites et de services, et la fiabilité alors que la structure de page de chaque site change silencieusement.",
  "coreLoopDIY": "Déclenche une action d’extension navigateur depuis la page que tu regardes, extrait des données structurées du DOM de cette page, et envoie-les à l’API d’un service connecté — fonctionnant même sur des sites qui n’offrent pas leur propre API.",
  "whatYouLose": [
    "des centaines de playbooks d’automatisation site/service préconstruits",
    "la fiabilité alors que la structure de page des sites cibles change dans le temps",
    "un constructeur d’automatisation visuel no-code",
    "des bibliothèques d’automatisation partagées en équipe"
  ],
  "whyPeopleStillPay": "Scraper la structure d’une page une fois, c’est facile ; maintenir une logique d’extraction fonctionnelle sur des centaines de sites qui se refont le design en permanence, sans que tu remarques que quelque chose s’est cassé en silence, c’est le fardeau de maintenance.",
  "prompt": "Construis une extension navigateur qui extrait des données de la page que tu regardes actuellement et les envoie à un service connecté — fonctionnant sur des sites sans API propre, ce qui est le vrai différenciateur de Bardeen par rapport à un outil purement API-à-API comme la fiche Pipedream de ce catalogue. Utilise une extension Chrome (Manifest V3) avec un content script qui, déclenché par un raccourci clavier ou un élément de menu contextuel clic-droit, extrait des données structurées de la page courante en utilisant des sélecteurs CSS que tu définis par site, comme le nom du produit, le prix et l’URL depuis une page e-commerce. Envoie les données extraites à l’API d’un service connecté — un tableur, une application de prise de notes, ou un CRM, choisis-en un — en utilisant l’API documentée de ce service et OAuth ou une clé API. Montre un aperçu de confirmation des données extraites avant l’envoi, pour qu’un sélecteur cassé par une refonte de site soit détecté avant que de mauvaises données soient envoyées, pas après. Stocke une petite bibliothèque de configurations d’extraction spécifiques par site, quels sélecteurs CSS correspondent à quels champs par domaine, en local, modifiable quand un site change et casse l’extraction. Ne construis pas une bibliothèque de nombreux playbooks préconstruits sur des dizaines de sites et de services, ni un constructeur visuel no-code — c’est hors périmètre ; ceci gère exactement les combinaisons site/service que tu configures toi-même. Nécessite un nom de domaine pour la gestion du callback OAuth et un enregistrement d’application OAuth auprès du service de destination choisi.",
  "faq": [
    { "q": "Ça marche sur des sites sans API propre ?", "a": "Oui — c’est le mécanisme central. Ça lit les données structurées directement dans le HTML de la page en utilisant des sélecteurs CSS, ce qui fonctionne peu importe si le site lui-même offre une API." },
    { "q": "Que se passe-t-il quand un site refait le design de sa page et casse les sélecteurs ?", "a": "L’extraction produira silencieusement des données fausses ou vides jusqu’à ce que tu le remarques et mettes à jour la config des sélecteurs — il y a un aperçu de confirmation spécifiquement pour attraper ça avant l’envoi de mauvaises données, mais la maintenance continue reste ta responsabilité." },
    { "q": "Combien de combinaisons site/service prend-elle en charge par défaut ?", "a": "Aucune préconstruite — tu configures chacune toi-même. La bibliothèque de centaines de playbooks prêts à l’emploi de Bardeen, c’est un vrai travail produit accumulé que cette construction n’inclut pas." },
    { "q": "Combien ça coûte à faire tourner ?", "a": "Un hébergement minimal pour la gestion du callback OAuth plus ce que coûte le service de destination lui-même — aucun frais par automatisation." }
  ]
}
