{
  "tagline": "Transforme un enregistrement fini en notes d’épisode, un brouillon de blog et des extraits sociaux au format citation — sans édition audio.",
  "verdictSummary": "Transcrire un épisode fini en local et demander à un LLM de produire des notes d’épisode, un brouillon de blog, et des citations à partir de cette transcription, c’est un vrai projet de week-end, pas une session — faire en sorte que les prompts trouvent de façon fiable de vrais moments citables (pas juste les premières phrases de chaque paragraphe) demande de vraies itérations. Contrairement à Alitu, cette construction ne fait aucun nettoyage audio ; elle suppose que tu as déjà un enregistrement fini et retraite les mots, pas le son.",
  "coreLoopDIY": "Transcris un fichier audio fini en local avec Whisper, puis interroge un LLM contre la transcription pour générer des notes d’épisode, un brouillon d’article de blog, des marqueurs de chapitre, et une poignée d’extraits au format citation adaptés aux posts sociaux.",
  "whatYouLose": [
    "tout nettoyage ou mastering audio — ceci retraite les mots d’un enregistrement déjà fini, ça ne touche pas au son",
    "une grande bibliothèque de templates de prompts testés et affinés par format de contenu",
    "des intégrations qui publient directement vers un hébergeur de podcast, un CMS, ou un planificateur social",
    "un traitement hébergé, pour qu’un long épisode n’accapare pas ta propre machine",
    "des workflows d’équipe pour relire le contenu généré avant publication"
  ],
  "whyPeopleStillPay": "Les gens paient Castmagic parce que faire en sorte qu’un LLM tire de façon fiable les trois ou quatre moments d’une conversation d’une heure qui valent vraiment la peine d’être cités — pas juste les plus forts ou les plus récents — demande une ingénierie de prompt affinée sur un énorme volume de vraies transcriptions, plus un pipeline de publication direct vers les outils que les créateurs utilisent déjà. Une construction perso obtient un premier brouillon fonctionnel ; elle n’obtient pas cet affinage ni l’étape de publication.",
  "prompt": "Construis un outil local de retraitement de contenu : transcris un enregistrement fini, puis génère des notes d’épisode, un brouillon de blog, et des citations sociales à partir de la transcription avec un LLM. Stack : Python, whisper.cpp pour la transcription locale, API Anthropic pour la génération de contenu, SQLite pour stocker transcriptions et sorties. Ne construis aucun nettoyage ou édition audio — c’est le travail d’un autre outil.\n\nBoucle centrale : l’utilisateur importe un fichier audio fini (déjà mixé et masterisé ailleurs). Transcris-le en local avec whisper.cpp, puis envoie la transcription à Claude avec des prompts séparés pour : des notes d’épisode (un résumé plus une liste de sujets horodatée), un brouillon d’article de blog approximatif dans les propres mots de l’intervenant plutôt qu’une réécriture générique, des marqueurs de chapitre dérivés des changements de sujet dans la transcription, et 5 à 8 courts extraits citables signalés avec leur horodatage pour les posts sociaux. Montre chaque pièce générée à côté du passage source de transcription dont elle provient, pour que l’utilisateur puisse la vérifier contre ce qui a vraiment été dit avant de publier quoi que ce soit.\n\nNécessite une clé API Anthropic — tout l’intérêt de cet outil, c’est l’étape de retraitement pilotée par LLM, donc contrairement à un pur outil de transcription, celui-ci en a vraiment besoin. Sans clé, la transcription fonctionne quand même et produit une transcription simple, mais aucun contenu dérivé n’est généré.\n\nNe construis pas : le nettoyage audio, le mastering, ou l’assemblage d’épisode (c’est le travail d’Alitu, pas de celui-ci), des intégrations de publication directe vers des hébergeurs de podcast ou des CMS, ni une marketplace de templates de prompts — livre un prompt bien affiné par type de sortie plutôt qu’une bibliothèque.",
  "faq": [
    { "q": "Puis-je importer mes transcriptions et sorties Castmagic existantes ?", "a": "Castmagic te laisse exporter les transcriptions et notes générées en texte, qui se collent directement. Régénérer le contenu dérivé (notes d’épisode, citations) avec les propres prompts de cette construction produira des résultats différents des versions affinées de Castmagic." },
    { "q": "Ça marche sur mon téléphone ?", "a": "Relire les notes d’épisode et citations générées fonctionne bien dans un navigateur mobile. Importer et transcrire un gros fichier audio est plus fiable depuis un ordinateur avec une connexion stable." },
    { "q": "Combien ça coûte à faire tourner ?", "a": "La transcription avec whisper.cpp est gratuite (calcul local seulement). Générer les notes d’épisode, un brouillon de blog et des citations pour un épisode coûte environ 0,10 à 0,30 $ en usage de l’API Claude, selon la longueur de l’épisode." },
    { "q": "Quelle est la seule chose qui ne survit pas à la reconstruction ?", "a": "Une sélection de citations constamment bonne. Un prompt bien affiné trouve de vrais moments réellement citables ; un prompt de premier jet ici a tendance à tirer ce qui est proche du début d’une phrase plutôt que ce qui est vraiment frappant, et cet écart ne se referme qu’avec de vraies itérations sur tes propres transcriptions." }
  ]
}
