{
  "tagline": "Un gestionnaire de mots de passe dont la vraie fonctionnalité est les alias email illimités pour cacher son adresse.",
  "verdictSummary": "La moitié coffre-fort est un terrain bien balisé et ce catalogue le dit déjà. La moitié alias, ce n’est pas du code du tout. Un alias ne fonctionne que si le courrier envoyé dessus arrive, ce qui veut dire un domaine avec des enregistrements SPF, DKIM et DMARC corrects, une boîte fourre-tout, et une réputation assez bonne pour que la copie transférée ne soit pas silencieusement rejetée. Tu peux configurer ça ; ce que tu ne peux pas faire, c’est obtenir les domaines d’alias partagés de Proton, ce qui est ce qui fait fonctionner la fonctionnalité pour les gens qui ne possèdent pas de domaine.",
  "coreLoopDIY": "Garde un coffre-fort local chiffré, et génère des alias par site sur un domaine fourre-tout que tu possèdes déjà, avec un relevé de quel alias appartient à quel site et un interrupteur pour arrêter de transférer l’un d’eux.",
  "whatYouLose": [
    "les alias sur les domaines partagés de Proton, qui n’ont besoin d’aucun domaine à toi",
    "l’infrastructure de courrier derrière le transfert, et la délivrabilité qui va avec",
    "les audits de sécurité indépendants du client et de la cryptographie",
    "la récupération de compte si tu perds le mot de passe maître"
  ],
  "whyPeopleStillPay": "Parce qu’un alias qui arrête de délivrer, c’est un compte perdu, et faire tourner ton propre transfert veut dire que tes réinitialisations de mot de passe dépendent de ton propre DNS et de ton propre serveur de courrier qui reste en marche.",
  "notes": "La moitié alias est ce qui fait de ça une fiche distincte plutôt qu’un coffre-fort de plus ; c’est aussi la moitié qui transforme un projet purement local en quelque chose avec une dépendance tierce difficile.",
  "prompt": "Construis un coffre-fort de mots de passe local avec une gestion d’alias email par site sur un domaine que l’utilisateur contrôle déjà.\n\nCoffre-fort : une application de bureau stockant les entrées chiffrées au repos. Dérive la clé du mot de passe maître avec Argon2id en utilisant un sel aléatoire par coffre et des paramètres écrits dans l’en-tête du coffre, pour pouvoir être renforcés plus tard. Chiffre avec un chiffrement authentifié d’une bibliothèque maintenue — n’assemble jamais de primitives à la main. Les entrées contiennent un titre, un identifiant, un mot de passe, un secret TOTP, une liste d’URL, et des notes, le tout à l’intérieur du blob chiffré ; seul le nombre d’entrées est visible sans déverrouillage.\n\nComportement du coffre : verrouillage automatique sur une minuterie et à la mise en veille du système, effacement du presse-papiers un nombre configurable de secondes après une copie, génération de mots de passe avec une politique de longueur et de classes de caractères, et prise en charge de l’import depuis 1Password, Bitwarden et CSV. L’export est toujours disponible, chiffré ou en clair, avec un avertissement sur le chemin en clair.\n\nGestion des alias, qui est ce qui distingue ce projet. L’utilisateur configure un domaine qu’il possède, avec une boîte fourre-tout qui reçoit déjà du courrier pour ce domaine — l’outil n’envoie ni ne reçoit jamais de courrier lui-même. Générer un alias crée une partie locale aléatoire sur ce domaine, la stocke contre l’entrée du coffre pour ce site, et enregistre la date. La liste des alias montre à quel site chacun appartient, quand il a été créé, et une note en texte libre sur son usage. Marquer un alias comme brûlé l’écrit dans un fichier de liste noire que l’utilisateur peut injecter dans les règles de filtrage de son fournisseur d’email ; l’outil ne peut pas arrêter le courrier lui-même et doit le dire.\n\nGuide de configuration : le README doit passer en revue les enregistrements DNS dont a besoin un fourre-tout (MX, SPF, DKIM, DMARC) et indiquer clairement que si l’un d’eux est faux, les alias perdront silencieusement du courrier, ce qui est pire que de ne pas en avoir.\n\nAffiche un avis persistant indiquant que ce projet n’a eu aucun audit de sécurité indépendant.\n\nHors périmètre : le remplissage automatique par extension navigateur, les applications mobiles, tout service de synchro, faire tourner un serveur de courrier, et les domaines d’alias partagés ou hébergés.",
  "faq": [
    { "q": "Est-ce que je peux importer mon coffre-fort Proton Pass ?", "a": "Oui, Proton Pass exporte en JSON et CSV, et les mots de passe, notes et secrets TOTP se transposent bien. Les alias arrivent comme des enregistrements, mais ils arrêtent de transférer dès que l’abonnement se termine, donc tout alias sur un domaine Proton doit être remplacé site par site à la main avant de résilier." },
    { "q": "Est-ce que j’ai vraiment besoin de mon propre domaine ?", "a": "Pour la moitié alias, oui. Sans ça, il n’y a nulle part où le courrier peut arriver, et l’outil se dégrade en simple coffre-fort local, ce que le catalogue couvre déjà mieux ailleurs. Un domaine pas cher plus un fournisseur d’email qui supporte le fourre-tout est le minimum." },
    { "q": "Combien ça coûte à faire tourner ?", "a": "Un domaine, environ dix à quinze dollars par an, plus une boîte mail qui supporte le fourre-tout, ce que beaucoup de fournisseurs incluent. Face à cinq dollars par mois pour Pass Plus, l’arithmétique favorise la construction — jusqu’à ce que tu comptes la soirée passée à bien régler DMARC." },
    { "q": "Quelle est la seule chose qui ne survit pas à la reconstruction ?", "a": "Des alias qui marchent tout simplement. Proton gère le chemin du courrier, donc un alias délivre dès le premier jour et délivre encore dans trois ans. Le tien dépend de ton DNS, de ton fournisseur et de tes renouvellements, et le mode d’échec, c’est un email de réinitialisation de mot de passe qui n’arrive jamais." }
  ]
}
