{
  "tagline": "Ready-made one-click automations between apps, rather than a builder to learn.",
  "verdictSummary": "Integrately's pitch is that you never build anything: you search for \"new form response to spreadsheet row\", click once, and it runs. That premise is entirely the catalogue — millions of pre-mapped recipes across hundreds of services, each of which somebody maintained through an API change. A personal build can execute a recipe file perfectly well. It cannot be a library, and a library of one is just an automation you wrote yourself.",
  "coreLoopDIY": "Write a recipe as a small declarative file describing a trigger, a field mapping and an action, and run it on a schedule with every execution logged and replayable.",
  "whatYouLose": [
    "the recipe catalogue, which is the entire product",
    "maintained OAuth applications for each connected service",
    "somebody noticing when a provider changes its API",
    "execution that continues while your own server is down"
  ],
  "whyPeopleStillPay": "Because the point is not running an automation, it is not having to think about one. A catalogue somebody else maintains through every API change is worth more than any execution engine.",
  "notes": "The recipe-as-a-file model is the angle: it is the honest personal-scale version of a catalogue, and it makes an automation something you can read, diff and share.",
  "prompt": "Build an automation runner whose unit of work is a declarative recipe file, not a visual canvas.\n\nRecipe format: a YAML file, versioned and readable, declaring:\n\n- a trigger: a service, an event, and a polling interval or a webhook path\n- a filter: an optional condition on the trigger payload\n- a mapping: target fields to expressions over the trigger payload, using a small, safe expression language (field access, string concatenation, a handful of functions like lower, trim, date format). No arbitrary code evaluation.\n- an action: a service, an operation, and the mapped fields\n- an idempotency key expression, so the same trigger event cannot produce two actions\n\nA recipe is a file in a directory. Importing one is copying it in; sharing one is sending it. This is what replaces a catalogue at personal scale, and it is why the format has to be readable by a human, not generated.\n\nServices: each is an adapter module with credentials stored encrypted, exposing the operations it supports and a JSON schema for each operation's inputs. Implement two services fully to prove the shape, and document adding a third in the README with a worked example. Validate a recipe against the declared schemas at load time, so a typo in a field name fails on import rather than at 3am.\n\nExecution: poll triggers on their interval, or accept webhooks at a per-recipe path with a shared secret. For each event, evaluate the filter, build the mapping, check the idempotency key against the executions table, and call the action. Record every execution: the trigger payload, the evaluated mapping, the action request and response, the outcome, and the duration.\n\nFailure handling: retry with exponential backoff on transient errors, stop and mark failed on a 4xx that is not a rate limit, and place permanently failed executions in a dead-letter list. Every dead-lettered execution can be replayed after fixing the recipe, using its stored trigger payload — this is the feature that makes a self-hosted automation trustworthy, because the alternative is losing the events that arrived while it was broken.\n\nDry run: execute a recipe against the last N real trigger events, showing every mapping and every intended action without performing any of them. Require a dry run to pass before a new recipe can be enabled.\n\nOut of scope: a visual builder, branching or looping control flow, more than one action per recipe, and any hosted multi-tenant deployment. If a task needs branching, it is two recipes.",
  "faq": [
    { "q": "Can I export my Integrately automations?", "a": "No, and there would be little point. Its automations are configuration inside its own platform against its own connectors, so each one is described again as a recipe file here. For a handful of automations that is an afternoon; for fifty it is not worth doing." },
    { "q": "Why one action per recipe?", "a": "Because multi-step workflows with branching are where a self-built automation runner becomes a maintenance burden, and where the failure modes stop being legible. Two chained recipes are easier to reason about, easier to replay and easier to fix than one branching one." },
    { "q": "What does it cost to run?", "a": "A small VPS with PostgreSQL, five to ten dollars a month, against Integrately's Starter plan. The APIs are free at personal volumes. The real cost is that your automations stop when your server does, and the dead-letter replay exists precisely because they will." },
    { "q": "What is the one thing that does not survive the rebuild?", "a": "The next integration. Your two services work well and the third is an evening of reading API documentation. Integrately's whole product is that the third one is a search box, and that somebody else fixes it when the provider changes it." }
  ]
}
